{
  "packet_id": "rs-acq-20260321-0ad88366",
  "source_url": "https://github.com/requests/requests",
  "source_type": "github",
  "raw_content": "# Requests\n\n**Requests** is a simple, yet elegant, HTTP library.\n\n```python\n>>> import requests\n>>> r = requests.get('https://httpbin.org/basic-auth/user/pass', auth=('user', 'pass'))\n>>> r.status_code\n200\n>>> r.headers['content-type']\n'application/json; charset=utf8'\n>>> r.encoding\n'utf-8'\n>>> r.text\n'{\"authenticated\": true, ...'\n>>> r.json()\n{'authenticated': True, ...}\n```\n\nRequests allows you to send HTTP/1.1 requests extremely easily. There’s no need to manually add query strings to your URLs, or to form-encode your `PUT` & `POST` data — but nowadays, just use the `json` method!\n\nRequests is one of the most downloaded Python packages today, pulling in around `30M downloads / week`— according to GitHub, Requests is currently [depended upon](https://github.com/psf/requests/network/dependents?package_id=UGFja2FnZS01NzA4OTExNg%3D%3D) by `1,000,000+` repositories. You may certainly put your trust in this code.\n\n[![Downloads](https://static.pepy.tech/badge/requests/month)](https://pepy.tech/project/requests)\n[![Supported Versions](https://img.shields.io/pypi/pyversions/requests.svg)](https://pypi.org/project/requests)\n[![Contributors](https://img.shields.io/github/contributors/psf/requests.svg)](https://github.com/psf/requests/graphs/contributors)\n\n## Installing Requests and Supported Versions\n\nRequests is available on PyPI:\n\n```console\n$ python -m pip install requests\n```\n\nRequests officially supports Python 3.10+.\n\n## Supported Features & Best–Practices\n\nRequests is ready for the demands of building robust and reliable HTTP–speaking applications, for the needs of today.\n\n- Keep-Alive & Connection Pooling\n- International Domains and URLs\n- Sessions with Cookie Persistence\n- Browser-style TLS/SSL Verification\n- Basic & Digest Authentication\n- Familiar `dict`–like Cookies\n- Automatic Content Decompression and Decoding\n- Multi-part File Uploads\n- SOCKS Proxy Support\n- Connection Timeouts\n- Streaming Downloads\n- Automatic honoring of `.netrc`\n- Chunked HTTP Requests\n\n## API Reference and User Guide available on [Read the Docs](https://requests.readthedocs.io)\n\n[![Read the Docs](https://raw.githubusercontent.com/psf/requests/main/ext/ss.png)](https://requests.readthedocs.io)\n\n## Cloning the repository\n\nWhen cloning the Requests repository, you may need to add the `-c\nfetch.fsck.badTimezone=ignore` flag to avoid an error about a bad commit timestamp (see\n[this issue](https://github.com/psf/requests/issues/2690) for more background):\n\n```shell\ngit clone -c fetch.fsck.badTimezone=ignore https://github.com/psf/requests.git\n```\n\nYou can also apply this setting to your global Git config:\n\n```shell\ngit config --global fetch.fsck.badTimezone ignore\n```\n\n---\n\n[![Kenneth Reitz](https://raw.githubusercontent.com/psf/requests/main/ext/kr.png)](https://kennethreitz.org) [![Python Software Foundation](https://raw.githubusercontent.com/psf/requests/main/ext/psf.png)](https://www.python.org/psf)",
  "metadata": {
    "repo": "requests/requests",
    "source": "readme",
    "url": "https://github.com/requests/requests"
  },
  "content_completeness": "full",
  "raw_content_format": "markdown",
  "created_at": "2026-03-21T03:55:36.457887Z",
  "captured_at": "2026-03-21T03:55:36.457887Z"
}