{
  "packet_id": "rs-intake-first-run-001",
  "source_url": "https://www.youtube.com/watch?v=i3ZlLmYn584",
  "source_type": "youtube",
  "raw_content": "This is how to build a polyarket trading\nbot using OpenClaw. And over the past\nthree days, I've gotten a lot of\nquestions around how did you build the\nPoly Market trading bot that just works\non its own that you just wake up and\nit's made you $15 in your sleep.\nAnd thinking about this, I thought the\nbest way of showing you how I've built\nit is by literally showing you how I've\nbuilt it, by showing you the prompts\nthat I used to work on this bot with\nMax, my AI agent. So, that being said,\nlet's let's get started with literally\nthe first prompt that I used on this\nexact project, which was I will give you\na list of posts I found about us making\nmoney. And then I proceeded to send him\na list of all the articles I managed to\nfind that popped on my feed about Poly\nMarket uh bots and OpenClaw\n[clears throat] making money together.\nAnd from that, it started telling me,\nGot it. let me pull these tweets. It\npulled all of the different tweets. It\nread through them. It understood what\nthey're about. And next up, I told him,\nLet's do the same. Ask them to make\nmoney. He always in in in my AI agents\nmax fashion, he said, Hell yes.\nLooking at what they're doing, they're\nbasically three money streams. And he\ncategorized the different articles.\nPolymarket referrals. Those are people\nwho just preach that they can make\nmoney, but the real way that they're\nmaking money is through the poly market\nreferral that they put in their\narticles. So, they're not really making\nmoney. Then there's copy trading bot\nreferrals as well. Then there's actual\nbot trading. Some are genuinely running\nbots on Poly Market 15inut Bitcoin\nEthereum markets. Here's what we can do.\nThis is the perfect play. We already\nstarted the the bot. I gave up on it a\ncouple of days ago. Basically was just a\nthought that I had back then. I didn't\nwant to put much time into it. I was\nlike, Hey, listen. We have the\ngroundwork. This is what we can do. I\nwanted to to to run the polyarket\nreferral link thing at first because\nthat's what most of the articles were\nusing. They weren't actually trading. I\nwas like, No, I want us to run the same\nbot. He's like, Got it. Let me check\nwhat we've already built and what we\nneed to get the same setup. Ah, I found\nthe markets. There are some short-term\nmarkets. Five minute, 15 minute, hourly,\nfour hours. Let me check if we can\nactually access and trade these. Bingo.\nI can see 15minute markets over here.\nFrom that,\nlet me see. So, from that, that was its\nentire response that I was just showing\nyou. And it finishes by build from\nscratch. I can write a simple Python bot\nusing our existing setup. What do you\nwant me to do? And that's where I told\nit, what do you think? I want you to\nlead this entirely.\nSo this is me getting you and giving you\na glimpse over the behind the scenes of\nhow I think when I develop my bot. I\ndon't want you to look at this and\nliterally copy paste what I said to it\nword by word because odds are it's going\nto reply to you differently.\nYou're not going to get the exact same\nresults. Instead, I want you to start\nthinking about\nhow do I think and how can I help my AI\nagent\nget to the goal I desire. You are the\noperator. Your AI agent is the engine.\nWith that being said, this is what it\ngave me. All right, I'll own this.\nHere's my call. My recommendation phase\none, let's validate. Let's spend this\nweek on validation. Which is why in all\nmy videos I say week one is about us\ntesting. Is about my AI agent learning.\nLet's fund this with $100. Let's track P\nprofit and loss for three to five days.\nPhase two, let's scale and or pivot.\nPhase three, let's document, which is\nexactly what I did. I literally followed\nits advice. What I need from you? I need\na poly market account funded. I need a\nVPS preference. Do you want to run this\non your Mac mini or on digital ocean\ndroplet? And what's your risk tolerance?\nAnd I answered these questions for it.\nAnd it got started. So that's it.\nover here it was saying boom it we went\nthrough a long setup phase of\nprobably like an hour or two long where\nI was figuring out how to create Poly\nMarket API so that it has access to my\nPoly Market account. I was figuring out\nhow to fund the the wallet that it\nneeded uh because Poly Market uses a\ndifferent wallet than the one you sign\nin with. I was figuring out how to give\nit full access to the things it needed\nand it was helping me out through that.\nAnd then we finished by send me the URL\nof the market that you want to start\nwith. I sent it the Bitcoin up and down\n15 minutes market. Found it. That market\njust ended. Let me get the full details\nand find the next active one. It found\nit. The current market up down the\npattern is so on and so forth. Let me\nupdate the bot and do a test trade.\nMinimum is five shares. Let me increase\nthe bet. First trade placed. And that\nwas literally my first tweet. I set up\nmy Poly Market bot wrong because what it\nended up doing is it placed the bet as\nsoon as the market opened. It was still\na 5050 chance. Literally, you can see 47\ncents,\n52 cents. It was literally a coin flip\nthat he was betting on. He didn't\nunderstand at that time that we needed\nto wait till the last minute. And\nalthough this was a coin flip, he\nmanaged to make the right decision. So,\nhe still managed to make $20 off of his\nfirst literal bet. We're truly living in\nthe future.\nBut from that, I asked him, is this how\nwe make money based on the articles I\nsent you? And he's like, honestly, not\nquite. From those articles, the real\nedge is exploiting the lag between\nBinance and chain link. For those of you\nwho don't know, uh the way Poly Market\nworks, it fetches the prices here.\nActually, why am I bothering explaining\nwhen it's literally explaining right\nhere? Poly Market results based on chain\nlink price feed, but chain link updates\nslower than Binance. So, the play is\nwatch Binance in real time. See Bitcoin\nmoving up hard. Chain link hasn't\nupdated yet. Poly market odds are stale.\nBuy up cheap before odds adjust. Chain\nlink catches up. You win. Want me to\nrebuild the bot with the chain link lag\nexploit? Yes, please. It rebuilt it with\nchain link arbitrage bot working.\nAnd then after that I asked it how can I\ncheck on our progress man and see how\nmuch we're making the trades etc. And\nthat birthed this next post that I made\nwhich was Max HQ. It literally went up\nand it created me this whole app uh with\nmore than just polyarket tracking. It\nallows me to see how my Poly Market bot\nis doing, how my hyperlquid bot is\ndoing, what I have on my agenda today,\nwhat it sent me as briefs, what tasks\nhave I assigned it to it. And that was\nliterally the first post. Finally found\na way to pay for my claw subscription.\nThat being said, I sent it Matic. I\nasked it to learn how to autoclaim on\nits own uh all of its winnings and it\nlaunched Sniperbot version two. here it\nwas making some mistakes as well uh\nwhich mainly were that\nthe lag detection wasn't quite working\nwell. It made some losses. I asked it\nhow can we what can we learn from these\nlosses and it spun up uh V2 new strategy\nrecords price at start of window snipes\nin last 30 seconds compares current\nversus start price so on and so forth.\nSo, it spun up a new strategy after the\nlosses it made. Perfect. Also, why was\nthere an order? Why wasn't there an\norder in the last 15 minutes? This was\nmore me trying to understand how it\nworks because I myself hadn't understood\nits full logic yet. And it literally\njust told me, you lit don't have to\nguess. You don't have to make your life\nhard. You can literally just ask it for\nthings and it will answer you.\nBut with that being said, that was that\nis the last slide. So that was the\nthought process that I used in building\nthis. There was a V1, there was a V2 and\nyesterday it managed to lose five trades\nconsecutively when the market went\nextremely volatile and a repeat scenario\nhappened from the screenshot where I was\nlike, hey, what happened here and what\ncan we learn? and it adjusted itself and\nit's now at its third version. Again,\nweek one is about testing,\nhypothesizing, and getting proof of\nconcept, proof that this actually works.\nAnd then week two is about scaling it\nfrom there.\nAgain, I don't want you to look at this\nand take the exact same prompts\nexpecting the exact same results.\nI want you to take away\nthe strategies you use in thinking when\nyou speak to open claw when you speak to\nyour AI agent. What information do you\ngive it?\nWhat goal do you define for it? How well\ndo you define the goal and the\nparameters for it to re to reach and\nachieve that goal? I hope this video has\nhelped. This is quite literally how I\nbuilt the bot. So, I hope this answers\nyour questions.",
  "created_at": "2026-03-20T12:00:00Z",
  "metadata": {
    "title": "How To Build A Polymarket Trading Bot (With OpenClaw)",
    "channel": "Sharbel A."
  },
  "content_completeness": "partial",
  "raw_content_format": "transcript",
  "purpose": "First Research Swarm v1 manual run; validates source → extraction → evaluation → archive pipeline"
}
